Region,Soil_Health,Groundwater_Status,Overall_Risk,Suggestion
Punjab,游댮 Bad soil,游댮 Water very low,游댮 High Risk,Try millet or bajra instead of cotton
Haryana,游댮 Poor soil,游댮 Critical water,游댮 High Risk,Use drip irrigation and grow pulses
Uttar Pradesh,游리 Okay soil,游릭 Water fine,游리 Medium Risk,Grow lentils or short-duration rice
Maharashtra,游릭 Good soil,游릭 Water good,游릭 Low Risk,Grow cotton or soybean
Tamil Nadu,游리 Medium soil,游릭 Water okay,游리 Medium Risk,Try groundnut or pulses
Kerala,游릭 Healthy soil,游릭 Water good,游릭 Safe,Best for paddy and spices
Andhra Pradesh,游리 Moderate soil,游리 Water moderate,游리 Medium Risk,Grow sunflower or jowar
Gujarat,游리 Medium soil,游릭 Good water,游리 Medium Risk,Try millet or peanuts
Bihar,游리 Moderate soil,游리 Water okay,游리 Medium Risk,Good for dal or maize
West Bengal,游릭 Good soil,游릭 Water good,游릭 Safe,Grow rice and vegetables

